{
  "$schema": "./configurability-registry.schema.json",
  "registryVersion": 1,
  "auditedMainSha": "873803296db243026e267eb6f371f31ed2f9d388",
  "auditedAt": "2026-08-06",
  "sourceDocuments": [
    "SPEC-07 — Método Operativo de Planificación Constructiva por Bloques v1.2",
    "SPEC-10 — Integración de Planner Next con EngineInput, ORC y publicación de producto",
    "SPEC-11 — Configuración Operativa Efectiva, Ocupaciones Derivadas y Coordinación entre Espacios",
    "SPEC11-001 — Auditoría de superficie configurable",
    "ADDENDA OFICIALES CONSOLIDADOS DE DOMINIO Y OPERACIÓN v1.0"
  ],
  "capabilities": [
    {
      "capabilityId": "PLAN_WORKDAY_WINDOW",
      "title": "Ventana temporal efectiva de jornada",
      "owner": "PLAN",
      "severity": "REQUIRED",
      "status": "PARTIAL",
      "productive": true,
      "hardcodeRisk": "LOW",
      "absenceSemantics": "Un plan válido debe conservar workStart y workEnd; no existe OFF productivo.",
      "layers": {
        "domain": "COMPLETE",
        "generalConfig": "COMPLETE",
        "dailySnapshot": "COMPLETE",
        "instanceOverride": "COMPLETE",
        "api": "COMPLETE",
        "ui": "COMPLETE",
        "buildInput": "COMPLETE",
        "engineInput": "COMPLETE",
        "preflight": "COMPLETE",
        "plannerNext": "COMPLETE",
        "searchOrScoring": "COMPLETE",
        "validation": "COMPLETE",
        "publication": "PARTIAL",
        "fingerprint": "PARTIAL",
        "evidence": "PARTIAL"
      },
      "blockers": [
        "Falta Evidence productiva común desde snapshot hasta publicación."
      ],
      "sourceRefs": [
        "SPEC10-008",
        "SPEC11-001"
      ]
    },
    {
      "capabilityId": "SPACE_AVAILABILITY_WINDOW",
      "title": "Disponibilidad temporal efectiva de espacios",
      "owner": "SPACE",
      "severity": "REQUIRED",
      "status": "COMPLETE",
      "productive": true,
      "hardcodeRisk": "NONE",
      "absenceSemantics": "null/null hereda la ventana efectiva del nivel superior sin materializar una hora universal.",
      "layers": {
        "domain": "COMPLETE",
        "generalConfig": "COMPLETE",
        "dailySnapshot": "COMPLETE",
        "instanceOverride": "COMPLETE",
        "api": "COMPLETE",
        "ui": "COMPLETE",
        "buildInput": "COMPLETE",
        "engineInput": "COMPLETE",
        "preflight": "COMPLETE",
        "plannerNext": "COMPLETE",
        "searchOrScoring": "COMPLETE",
        "validation": "COMPLETE",
        "publication": "COMPLETE",
        "fingerprint": "COMPLETE",
        "evidence": "COMPLETE"
      },
      "blockers": [],
      "sourceRefs": [
        "SPEC10-008",
        "SPEC10-009",
        "SPEC11-001"
      ]
    },
    {
      "capabilityId": "RESOURCE_AVAILABILITY_WINDOW",
      "title": "Disponibilidad temporal efectiva de recursos",
      "owner": "RESOURCE",
      "severity": "REQUIRED",
      "status": "COMPLETE",
      "productive": true,
      "hardcodeRisk": "NONE",
      "absenceSemantics": "null/null representa jornada completa dinámica; isAvailable es un interruptor independiente.",
      "layers": {
        "domain": "COMPLETE",
        "generalConfig": "COMPLETE",
        "dailySnapshot": "COMPLETE",
        "instanceOverride": "COMPLETE",
        "api": "COMPLETE",
        "ui": "COMPLETE",
        "buildInput": "COMPLETE",
        "engineInput": "COMPLETE",
        "preflight": "COMPLETE",
        "plannerNext": "COMPLETE",
        "searchOrScoring": "COMPLETE",
        "validation": "COMPLETE",
        "publication": "COMPLETE",
        "fingerprint": "COMPLETE",
        "evidence": "COMPLETE"
      },
      "blockers": [],
      "sourceRefs": [
        "SPEC10-006",
        "SPEC10-007",
        "SPEC10-014",
        "SPEC11-001"
      ]
    },
    {
      "capabilityId": "PARTICIPANT_AVAILABILITY_WINDOW",
      "title": "Disponibilidad temporal efectiva de participantes",
      "owner": "PARTICIPANT",
      "severity": "REQUIRED",
      "status": "PARTIAL",
      "productive": true,
      "hardcodeRisk": "LOW",
      "absenceSemantics": "La disponibilidad pertenece al participante del plan; no existe un catálogo general equivalente completo.",
      "layers": {
        "domain": "COMPLETE",
        "generalConfig": "N_A",
        "dailySnapshot": "COMPLETE",
        "instanceOverride": "PARTIAL",
        "api": "COMPLETE",
        "ui": "COMPLETE",
        "buildInput": "COMPLETE",
        "engineInput": "COMPLETE",
        "preflight": "COMPLETE",
        "plannerNext": "COMPLETE",
        "searchOrScoring": "COMPLETE",
        "validation": "COMPLETE",
        "publication": "PARTIAL",
        "fingerprint": "PARTIAL",
        "evidence": "PARTIAL"
      },
      "blockers": [
        "Origen y versión no están homogeneizados con el resto de snapshots."
      ],
      "sourceRefs": [
        "SPEC11-001",
        "ADDENDA OFICIALES CONSOLIDADOS v1.0"
      ]
    },
    {
      "capabilityId": "TASK_DURATION_EFFECTIVE",
      "title": "Duración productiva efectiva de tarea",
      "owner": "DAILY_TASK",
      "severity": "REQUIRED",
      "status": "UNSAFE",
      "productive": true,
      "hardcodeRisk": "HIGH",
      "absenceSemantics": "Debe resolver override de instancia sobre snapshot diario; actualmente puede releer el default global de plantilla.",
      "layers": {
        "domain": "COMPLETE",
        "generalConfig": "COMPLETE",
        "dailySnapshot": "ABSENT",
        "instanceOverride": "COMPLETE",
        "api": "COMPLETE",
        "ui": "COMPLETE",
        "buildInput": "UNSAFE",
        "engineInput": "COMPLETE",
        "preflight": "COMPLETE",
        "plannerNext": "COMPLETE",
        "searchOrScoring": "COMPLETE",
        "validation": "COMPLETE",
        "publication": "PARTIAL",
        "fingerprint": "PARTIAL",
        "evidence": "PARTIAL"
      },
      "blockers": [
        "No existe snapshot tipado de plantilla por plan.",
        "buildEngineInput puede reinterpretar días existentes desde task_templates.",
        "Existen fallbacks de duración no trazados de forma uniforme."
      ],
      "sourceRefs": [
        "SPEC11-001 CFS-001",
        "SPEC11-002 diseño"
      ]
    },
    {
      "capabilityId": "TASK_DEPENDENCY_EFFECTIVE",
      "title": "Dependencias efectivas de tareas",
      "owner": "DAILY_TASK",
      "severity": "REQUIRED",
      "status": "UNSAFE",
      "productive": true,
      "hardcodeRisk": "HIGH",
      "absenceSemantics": "Una tarea sin dependencias efectivas no tiene prerrequisitos; la ausencia no puede reconstruirse desde un catálogo global mutable.",
      "layers": {
        "domain": "COMPLETE",
        "generalConfig": "COMPLETE",
        "dailySnapshot": "ABSENT",
        "instanceOverride": "PARTIAL",
        "api": "PARTIAL",
        "ui": "PARTIAL",
        "buildInput": "UNSAFE",
        "engineInput": "COMPLETE",
        "preflight": "COMPLETE",
        "plannerNext": "COMPLETE",
        "searchOrScoring": "COMPLETE",
        "validation": "COMPLETE",
        "publication": "PARTIAL",
        "fingerprint": "PARTIAL",
        "evidence": "PARTIAL"
      },
      "blockers": [
        "Dependencias de plantilla no están congeladas por día.",
        "Los formatos legacy único y múltiple necesitan normalización común."
      ],
      "sourceRefs": [
        "SPEC-06",
        "SPEC11-001 CFS-001",
        "SPEC11-002 diseño"
      ]
    },
    {
      "capabilityId": "TASK_RESOURCE_REQUIREMENTS_EFFECTIVE",
      "title": "Requisitos efectivos de recursos de tarea",
      "owner": "DAILY_TASK",
      "severity": "REQUIRED",
      "status": "UNSAFE",
      "productive": true,
      "hardcodeRisk": "HIGH",
      "absenceSemantics": "La ausencia significa que no existe requisito heredado adicional; no puede obtenerse mediante fallo de carga ni JSON inválido neutralizado.",
      "layers": {
        "domain": "COMPLETE",
        "generalConfig": "PARTIAL",
        "dailySnapshot": "ABSENT",
        "instanceOverride": "COMPLETE",
        "api": "PARTIAL",
        "ui": "PARTIAL",
        "buildInput": "UNSAFE",
        "engineInput": "COMPLETE",
        "preflight": "COMPLETE",
        "plannerNext": "PARTIAL",
        "searchOrScoring": "PARTIAL",
        "validation": "PARTIAL",
        "publication": "PARTIAL",
        "fingerprint": "PARTIAL",
        "evidence": "PARTIAL"
      },
      "blockers": [
        "resourceRequirements continúa siendo demasiado amplio y no versionado.",
        "Falta snapshot diario de requisitos de plantilla.",
        "Algunas fuentes pueden degradarse a colecciones vacías."
      ],
      "sourceRefs": [
        "ADDENDA OFICIALES CONSOLIDADOS v1.0",
        "SPEC11-001 CFS-004",
        "SPEC11-001 CFS-007"
      ]
    },
    {
      "capabilityId": "PLAN_TASK_TEMPLATE_SNAPSHOT",
      "title": "Snapshot efectivo de plantillas por plan",
      "owner": "PLAN",
      "severity": "N_A",
      "status": "DOCUMENTED_ONLY",
      "productive": false,
      "hardcodeRisk": "CRITICAL",
      "absenceSemantics": "Los planes legacy deben usar backfill marcado; la planificación no puede crear snapshots ni releer silenciosamente el catálogo global.",
      "layers": {
        "domain": "COMPLETE",
        "generalConfig": "COMPLETE",
        "dailySnapshot": "DOCUMENTED_ONLY",
        "instanceOverride": "DOCUMENTED_ONLY",
        "api": "DOCUMENTED_ONLY",
        "ui": "ABSENT",
        "buildInput": "ABSENT",
        "engineInput": "ABSENT",
        "preflight": "ABSENT",
        "plannerNext": "N_A",
        "searchOrScoring": "N_A",
        "validation": "DOCUMENTED_ONLY",
        "publication": "ABSENT",
        "fingerprint": "DOCUMENTED_ONLY",
        "evidence": "ABSENT"
      },
      "blockers": [
        "Implementación DB Safe Merge pausada.",
        "Faltan migración, RLS, storage, buildInput y tests completos."
      ],
      "sourceRefs": [
        "SPEC11-001",
        "SPEC11-002 diseño",
        "PR #630 pausado"
      ]